type,text,has_phone_number,has_special_chars,has_all_caps_words,has_url,is_mixed_language,has_currency,has_id_code,has_emoji,date/time,has_repeated_words,has_consecutive_special_chars,has_subscriber_code,avg_word_length,has_landline_number,word_length
Promo,"জিঅ 5G গ্ৰাহকসকলৰ বাবে বিশেষ অফাৰ
জিঅ এয়াৰফাইবৰ মাত্ৰ ₹1111ত ৫০ দিনৰ বাবে
সঁগত: মফৎ ইন্সটলেচন + ₹1000 কুপন
এতিয়া বুক কৰক bit.ly/Jio_SMS",0,1,1,1,1,1,0,0,0,1,0,1,4.95,0,118
Promo,"জিঅ'ফাইবাৰে আপোনাক স্বাস্থ্য আৰু ফিট্নেছ এপসমূহৰ বিনামূলীয়া এক্সেচ প্ৰদান কৰে। আমাৰ ওচৰত ওজন হ্ৰাস, মহিলাৰ স্বাস্থ্য, যোগাসন আৰু অন্যান্যৰ বাবে এপ আছে।
মাত্ৰ 599 টকা/মাহৰ পৰা আৰম্ভ হোৱা জিঅ'ফাইবাৰ প্লেনৰ সৈতে এই সকলোবোৰ লাভ কৰক।
আপোনাৰ জিঅ'ফাইবাৰ প্লেন এতিয়াই বুক কৰিবলৈ www.jio.com/r/woQCzLVBV -ত ক্লিক কৰক!",0,1,0,1,1,1,0,0,0,1,0,0,5.58,0,268
Ham,"299.0  টকাৰ ৰিচাৰ্জ সফল হৈছে!
Jio নম্বৰ : 7002983153।
প্ৰাপ্য:
Benefits: Unlimited Voice, Unlimited data - 42GB(1.5GB/Day), 100 SMS/Day & Subscription to Jio Apps. Validity - 28 Days।
লেনদেন আইডি:10003863133608
পৰিকল্পনাৰ বিৱৰণ চাওক - https://www.jio.com/dl/my_plans
আপোনাৰ শেহতীয়া ৰিচাৰ্জ অভিজ্ঞতা আমাৰ সৈতে ভাগ বতৰা কৰক - https://www.jio.com/en-in/jio-rech-exp-survey-assamese?custid=10003863133608",1,1,1,1,1,1,1,0,0,1,1,0,7.83,0,361
Promo,Jio 'ৰ সৈতে সংযুক্ত হৈ থাকক আৰু Jio 'ৰ বিশ্বমানৰ সেৱা উপভোগ কৰি থাকক যিটো আজিও আটাইতকৈ সুলভ হৈ আছে।,0,1,0,0,1,0,0,0,0,1,0,0,3.85,0,80
promo,অতুলনীয় সেৱাৰ সৈতে ভাৰতৰ একমাত্ৰ প্ৰকৃত 5G নেটৱৰ্কৰ অভিজ্ঞতা লাভ কৰক। প্ৰতিমাহে মাত্ৰ Rs. 349 ৰ পৰা আৰম্ভ কৰি সীমাহীন 5G ডাটা উপভোগ কৰক। প্লাছ প্ৰতিমাহে ২০% পৰ্যন্ত ৰাহি কৰক অন্য অপাৰেটৰ পৰা !,0,1,0,0,1,1,0,0,0,1,0,0,4.7,0,160
spam,Jio ৰ সৈতে যোগাযোগৰ বাবে আপোনাৰ পছন্দৰ ভাষা বাছনি কৰক আৰু কেৱল আপোনাৰ পছন্দ ভাষাত আপডেট লাভ কৰক। ভাষা সলনি কৰিবলৈ https://t.jio/WPZ4V ক্লিক কৰক। টিম Jio,0,1,1,1,1,0,0,0,0,1,1,0,4.62,0,127
promo,"চাইবাৰ সুৰক্ষিত হওক! আপোনাৰ ডিভাইচক বটনেট সংক্ৰমণ আৰু মেলৱেৰৰ পৰা সুৰক্ষিত কৰিবলে CERT-In GoI এ পৰামৰ্শ দিয়ে যে ""Free Bot Removal Tool"" ডাউনলোড কৰিবলৈ https://www.csk.gov.in",0,1,1,1,1,0,0,0,0,1,1,0,5.6,0,150
spam,এয়াৰটেল পেক 7086110961 ত 31-12-2021 ত সমাপ্ত হ'ব। আপোনাৰ বৰ্তমান বৈধতা নেহেৰুৱাই আজি ৰিচাৰ্জ কৰক u.airtel.in/FDP2 ইতিমধ্যে কৰিলে উপেক্ষা কৰক|,1,1,1,0,1,0,1,0,1,1,0,1,5.75,1,123
spam ,এয়াৰটেল পেক 7086110961 ত আজি ৰাতি শেষ হ'ব। অব্যাহত সেৱাৰ বাবে আপোনাৰ প্ৰিয় আনলিমিটেড পেকৰ সৈতে ৰিচাৰ্জ কৰক u.airtel.in/FDP2 ইতিমধ্যে কৰিলে উপেক্ষা কৰক|,1,1,1,0,1,0,1,0,0,1,0,0,5.43,0,131
spam,এয়াৰটেল অসীমিত পেকৰ বৈধতা 7086110961 ত 08-10-2021 ৰ লৈকে আছে। আপোনাৰ বৰ্তমান বৈধতা নেহেৰুৱাই আজি ৰিচাৰ্জ কৰক u.airtel.in/FDP2 ইতিমধ্যে কৰিলে উপেক্ষা কৰক।,1,1,1,0,1,0,1,0,1,1,0,1,5.73,1,133
spam,"এলার্ট 90%: আপোনাৰ দৈনিক হাই স্পীডৰ ডাটা সীমাৰ বাবে। 2GB ডাটা লাভ কৰক মাত্ৰ Rs33 ত, মাজনিশালৈকে বৈধ।এতিয়াই ৰিচাৰ্জ কৰক i.airtel.in/dtpck",0,1,1,0,1,1,0,0,0,1,0,0,5.19,0,117
spam,"সূচনা: Rs 9,00,000 লৈকে ঋণ প্ৰদান 7086110961 -ৰ বাবে! এয়াৰটেল ফ্লেক্সি ক্ৰেডিটৰ সৈতে ছেকেণ্ডত আপোনাৰ একাউণ্টত টকা প্ৰাপ্ত কৰক। কোনো কাগজপত্ৰ নাই। এতিয়াই লাভ কৰক https://i.airtel.in/FSLOANNM",1,1,1,1,1,1,1,0,0,1,1,1,5.88,0,166
spam,"ধুমুহাৰ বতৰৰ আগতেই ঘৰৰ দুৱাৰ-খিৰিকীৰ খিলি, চিত্কলি আদি ব্যৱহাৰ যোগ্য হৈ আছে নে নাই, দুৱাৰ-খিৰিকীত ফাঁক বা কাঁচ আদি ভাঙি আছে নেকি পৰীক্ষা কৰি মেৰামতি কৰাই লওঁক । ASDMA",0,1,1,0,1,0,0,0,0,1,0,0,4.75,0,138
spam,"বিজুলী ঢেৰেকনি হৈ থকাৰ সময়ত যদি আপুনি নাওঁ বাই বা সাতুঁৰি আছে, তেন্তে ততালিকে পাৰলৈ আহি নিৰাপদ আশ্ৰয় গ্ৰহণ কৰক । ASDMA",0,0,1,0,1,0,0,0,0,0,0,0,4.52,0,97
spam,"Silchar আপনি কি আপনার নেটওয়ার্ক অভিজ্ঞতাকে পরবর্তী স্তরে নিয়ে যাওয়ার জন্য প্রস্তুত?
Airtel 5G Plus শীঘ্রই আসছে আপনার শহরে। আপনি 5G এর জন্য প্রস্তুত কিনা তা জানতে, ক্লিক করুন i.airtel.in/air5G এ।",0,1,0,0,1,0,0,0,0,1,0,0,5.13,0,167
spam,"ভভূমিকম্পৰ সময়ত ফুলৰ টাব, ফল্চ্ চিলিং, বৈদ্যুতিক তাঁৰ, বৈদ্যুতিক খুটা, বেৰ, ওখ গছ, আদি বাগৰি পৰিব পৰা বস্তুৰ ওচৰে পাজৰে থকাৰ পৰা বিৰত থাকক । ASDMA",0,0,1,0,1,0,0,0,0,1,0,0,4.56,0,121
spam,"শীতকালত সুৰাপান নকৰিব। ই শৰীৰৰ তাপমাত্ৰা বৃদ্ধি নকৰে, ইয়াৰ পৰিৱৰ্তে শৰীৰৰ তাপমাত্ৰা হ্ৰাস হে কৰে। ASDMA",0,0,1,0,1,0,0,0,0,1,0,0,5.31,0,88
spam,"ভূমিস্খলনৰ ক্ষেত্ৰত পাহাৰৰ পৰা নামি অহা পানীৰ সৈতে শিল, বালি বা মাটিও নামি অহা দেখিলে সাৱধান হওক । ASDMA",0,0,1,0,1,0,0,0,0,1,0,0,4.67,0,86
spam,"ভূমিস্খলনৰ ক্ষেত্ৰত আচৰিত ধৰণৰ শব্দ শুনিলে (শিলৰ শব্দ, গছ-ভঙা, পানীৰ তীব্ৰ শব্দ, মাটি খহি অহাৰ শব্দ) সাৱধান হওক I ASDMA",0,1,1,0,1,0,0,0,0,1,0,0,4.7,0,100
spam,ভূমিস্খলন ৰোধ কৰিবলৈ বৰষুণৰ দিনবোৰত মাটি কটা কাম বা মাটি ঢিলা কৰিব পৰা কাম নকৰিব । ASDMA,0,0,1,0,1,0,0,0,0,1,0,0,4.44,0,72
spam,ভূমিস্খলন ৰোধ কৰিবলৈ পাহাৰীয়া এঢলীয়া ঠাইত ডাঙৰ গছৰ সলনি মাটি ধৰি ৰাখিব পৰা গছপুলি ৰোৱাৰ ব্যৱস্থা কৰক । ASDMA,0,0,1,0,1,0,0,0,0,0,0,0,4.94,0,90
spam,"ভূমিস্খলনৰ সম্ভাৱনা থকা অঞ্চলৰ বাসিন্দাসকলে পৰ্যাপ্ত পৰিমাণে মোবাইল ফোনৰ ৰিচাৰ্জ কৰি থওঁক, লগতে বেটাৰীচালিত ৰেডিঅ’ আৰু টৰ্চ লাইট নিজৰ লগত ৰাখক । ASDMA",0,0,1,0,1,0,0,0,0,0,0,0,5.68,0,128
spam,"যদি গৰমৰ দিনত আপুনি ঘৰৰ বাহিৰত কাম কৰি আছে, তেন্তে আপুনি পিয়াহ অনুভৱ নকৰিলেও যথেষ্ট পৰিমাণে পানী খাব(অন্তত 3 গিলাছ প্ৰতি ঘন্টাত)| ASDMA",0,1,1,0,1,0,0,0,0,1,0,0,4.74,0,113
spam,বানপানীৰ সময়ত নলা নৰ্দমাত পানী জমা নহ´বৰ বাবে বানপানীৰ দিন আৰম্ভ হোৱাৰ পূৰ্বে নলাত প্লাষ্টিক জাবৰ জোথৰৰ নিচিনা আৱৰ্জনা পেলোৱা বন্ধ কৰক| ASDMA,0,1,1,0,1,0,0,0,0,1,0,0,5.09,0,119
spam,দিনটোৰ অত্যন্ত গৰমৰ সময়খিনিত পৰাপক্ষত ঘৰৰ বাহিৰলৈ নোলাব I ASDMA,0,0,1,0,1,0,0,0,0,0,0,0,5.4,0,54
spam,"গৰমৰ দিনত যদি আপুনি ঘৰৰ বাহিৰত কামত ব্যস্ত থাকে, পিয়াহ অনুভৱ নকৰিলেও অন্ততঃ এঘণ্টাৰ মূৰে মূৰে ৩ গ্লাছ বিশুদ্ধ পানী খাব I (ASDMA)",0,1,1,0,1,0,0,0,0,1,0,0,4.48,0,106
spam,গৰমৰ দিনত ঘৰৰ বাহিৰলৈ ওলাই যাবলগীয়া হলে সদায় ছাতি লগত লৈ ওলাব আৰু পৰাপক্ষত পাতল ৰঙৰ কপাহী কাপোৰহে পৰিধান কৰিব I ASDMA,0,0,1,0,1,0,0,0,0,0,0,0,4.36,0,96
spam,"গৰমৰ দিনত পৰাপক্ষত কেফেইন্, এলক’হল বা চেনী যুক্ত পানীয় পৰিহাৰ কৰিব I ASDMA",0,0,1,0,1,0,0,0,0,0,0,0,4.62,0,62
spam,"গৰমৰ দিনত আপোনাৰ শিশুক দুৱাৰ-খিৰিকী মাৰি গাড়ীৰ ভিতৰত এৰি থৈ নাযাব, কিয়নো বন্ধ গাড়ীৰ ভিতৰৰ তাপমাত্ৰা মিনিটৰ ভিতৰতে ১৪০° পৰ্যন্ত হৈ যাব পাৰে I(ASDMA)",0,1,1,0,1,0,0,0,0,1,0,0,4.96,0,124
spam,বানৰ সময়ত নলা-ন্ৰ্দমাত পানী জমা নহ’বৰ বাবে নলাত প্লাষ্টিক জাৱৰ-জোথৰ আদি নেপেলাব - ASDMA,0,1,1,0,1,0,0,0,0,0,0,0,5.38,0,74
spam,বানৰ সময়ত ব্যৱহাৰৰ বাবে আৱ্শ্যকীয় সামগ্ৰীৰ জৰুৰীকালীন টোপোলা যোগাৰ কৰি থওক - ASDMA,0,1,1,0,1,0,0,0,0,0,0,0,5.75,0,70
spam,"নমস্কাৰ।মিছন বসুন্ধৰাৰ ২.০ সেৱাসমূহৰ বাবে অনলাইনযোগে আপুনি www.rtps.assam.gov.in ত আৱেদন কৰক অথবা নিকটৱৰ্তী ৰাজহুৱা সুবিধা কেন্দ্ৰলৈ আহি ৩১ মাৰ্চ, ২০২৩ ৰ আগতে আৱেদন সম্পন্ন কৰক ।- DLR&S etc. Assam",0,1,1,1,1,0,0,0,1,1,0,1,5.61,0,168
spam,"আপোনাৰ ৰিচাৰ্জত কেছবেক বিচাৰে নেকি?
আপোনাৰ বৰ্তমানৰ পেক সমাপ্ত হ'ব। আপোনাৰ এয়াৰটেল নম্বৰ Phonepeত ৰিচাৰ্জ কৰক,কেছবেক* উপাৰ্জনৰ সুযোগ পাওক।ক্লিক https://phon.pe/airtelas",0,1,0,1,1,0,0,0,0,1,1,0,6.95,0,151
spam,"অগ্নিকাণ্ডৰ কাৰণবোৰৰ বিষয়ে জানক, সজাগ হওক আৰু সুৰক্ষিত থাকক । ASDMA",0,0,1,0,1,0,0,0,0,0,0,0,5.5,0,57
spam,"জুই প্ৰশমনৰ বাবে পৰম্পৰাগত ভাৱে ব্যৱহাৰ কৰা বস্তু যেনে, বালিৰে ভৰা টোপোলা, কম্বল্, কপাহী কাপোৰ আদি হাতেৰে ঢুকি পোৱা ঠাইত ৰাখক যাতে বিছাৰিলে পোৱা যায় । ASDMA",0,0,1,0,1,0,0,0,0,1,0,0,4.85,0,130
spam,"অগ্নিকাণ্ডৰ সময়চোৱাত ঘৰৰ ভিতৰত থাকিলে, ভিতৰৰ পৰা ওলাই আহিবলৈ চাপৰি লওঁক । ASDMA",0,0,1,0,1,0,0,0,0,0,0,0,5.42,0,67
spam,"শীতকালত সুৰাপান নকৰিব। ই শৰীৰৰ তাপমাত্ৰা বৃদ্ধি নকৰে, ইয়াৰ পৰিৱৰ্তে শৰীৰৰ তাপমাত্ৰা হ্ৰাস হে কৰে। ASDMA",0,0,1,0,1,0,0,0,0,1,0,0,5.31,0,88
spam,ভূমিকম্পৰ সময়চোৱাত জোঁকাৰণিৰ অনুভৱ হোৱাৰ লগে লগে কোনো মজবুত মেজ বা অলপ ওখ বিচনাৰ তলত আশ্ৰয় লওঁক । ASDMA,0,0,1,0,1,0,0,0,0,1,0,0,4.67,0,85
spam,"ভূমিকম্পৰ সময়ত আইনাৰ বেৰ, খিৰিকী বা দুৱাৰৰ ওচৰে পাজৰে থকাৰ পৰা বিৰত থাকক । ASDMA",0,0,1,0,1,0,0,0,0,0,0,0,4.57,0,66
spam,"আপোনাৰ পছন্দৰ Rs. 19 এয়াৰটেল পেক এতিয়া Rs. 22 -ত উপলব্ধ। লাভালাভৰ পৰিৱৰ্তনবোৰ জানিবলৈ, এয়াৰটেল থেংক্স এপলৈ যাওঁক u.airtel.in/rch3",0,1,0,0,1,1,0,0,0,1,0,0,5.58,0,114
spam,বানপানীত আপোনাৰ সুৰক্ষাৰ বাবে জৰুৰী নথিপত্ৰ আৰু মূ্ল্যৱান সামগ্ৰীসমূহ জল্-প্ৰ্তিৰোধক মোনাত ৰাখক । ASDMA,0,1,1,0,1,0,0,0,0,0,0,0,6.77,0,90
spam,গৰমৰ দিনত পিয়াহ নালাগিলেও পৰ্যাপ্ত পৰিমানৰ বিশুদ্ধ পানী সঘনাই খাব । ASDMA,0,0,1,0,1,0,0,0,0,0,0,0,5.55,0,62
spam,ধগৰমৰ দিনত ঘৰৰ বাহিৰলৈ ওলাই যাবলগীয়া হলে সদায় ছাতি লগত লৈ ওলাব আৰু পৰাপক্ষত পাতল ৰঙৰ কপাহী কাপোৰহে পৰিধান কৰিব। ASDMA,0,0,1,0,1,0,0,0,0,0,0,0,4.57,0,97
spam,"ধুমুহাৰ সময়ত আপুনি যদি চলন্ত গাড়ীত আছে, তেনেহ’লে বৈদ্যুতিক তাঁৰ, গছ আদিৰ পৰা আঁতৰত নিৰাপদ ঠাইত গাড়ীখন ৰাখিবলৈ চালকক কঁওক । ASDMA",0,0,1,0,1,0,0,0,0,0,0,0,4.9,0,107
spam,অকৰ্তৃত্বশীল ফৰেক্স ট্ৰেডিং প্লেটফৰ্মত লেনদেন নকৰিব। অধিক তথ্যৰ বাবে চাওঁক https://bit.ly/rbi_pr -RBI,0,1,1,1,1,0,0,0,0,0,1,0,6.92,0,90
spam,আৰ বি আইয়ে কেতিয়াও জনসাধাৰণৰ পৰা তেওঁলোকৰ ব্যক্তিগত/বেংকৰ সবিশেষ নিবিচাৰে। আৰ বি আইৰ ভুৱা প্ৰতীক আৰু মেছেজৰ পৰা সাৱধান। -RBI,0,1,1,0,1,0,0,0,0,1,0,0,5.15,0,107
spam,আপোনাৰ ফোন/ ডিভাইচত যিকোনো অজ্ঞাত এপ ডাউনলোড অথবা যিকোনো অজ্ঞাত লিংকত ক্লিক নকৰিব। এপ/লিংকটোৱে আপোনাৰ বিত্তীয় তথ্য সংগ্ৰহ কৰাৰ সুযোগ ল'ব পাৰে। -RBI,0,1,1,0,1,0,0,0,0,1,0,0,5.17,0,125
spam,"যদি আপুনি নকৰা ডেবিট লেনদেনৰ বাবে এছএমএছ লাভ কৰে, তেন্তে তৎক্ষণাত ইউপিআইকে ধৰি ডেবিটৰ সকলো মোড ব্লক কৰক। লগতে আপোনাৰ বেংক/ই-ৱালেটক জনাওক। -RBI",0,1,1,0,1,0,0,0,0,0,0,0,4.96,0,120
spam,"ক্ৰেডিট কাৰ্ডৰ সুবিধা গ্ৰহণ কৰাৰ সময়ত, চৰ্ত আৰু নিয়মাৱলী, সুতৰ হাৰ আৰু অন্যান্য মাচুল/চাৰ্জৰ বাবে মূল তথ্য বিবৃতি ভালদৰে পঢ়ক। -RBI",0,1,1,0,1,0,0,0,0,1,0,0,5.1,0,112
spam,আপোনাৰ অভিযোগ প্ৰথমে বেংক/এনবিএফচি/ধন পৰিশোধ ব্যৱস্থাপনাৰ অংশগ্ৰহণকাৰী/ক্ৰেডিট ইনফৰ্মেশ্যন কোম্পানীত দাখিল কৰক। যদি 30 দিনৰ ভিতৰত সমাধান নহয় তেন্তে cms.rbi.org.in-ত অভিযোগ দাখিল কৰক। -RBI,0,1,1,0,1,1,0,0,0,1,0,0,6.78,0,166
spam,KYC আপডেট/একাউণ্ট ব্লক কৰা/ লোন অফাৰৰ প্ৰৱঞ্চনামূলক কল/SMS/লিংকৰ পৰা সাৱধান হওক। এনে সন্দেহজনক মেছেজ https://sancharsaathi.gov.in ত অভিযোগ দিয়ক। -RBI,0,1,1,1,1,1,0,0,0,0,1,0,6.26,0,131
spam,your favourite athletes চেনেল Sony Ten 3 -ত চাবলৈ মিচ নকৰিব! উপভোগ কৰক লাইভ Commonwealth Games মেচ এয়াৰটেল ডিজিটেল TV -ত Rs20.06/মাহত| চাবস্ক্ৰাইব কৰিবৰ বাবে আপোনাৰ ৰেজিষ্টাৰ মোবাইল নম্বৰৰ পৰা 9154052289 -ত মিচ কল দিয়ক|,1,1,1,0,1,1,1,0,0,1,0,1,5.06,0,185
spam,Chelsea vs AC Milan চেনেল Sony Ten 2 -ত চাবলৈ মিচ নকৰিব! উপভোগ কৰক লাইভ UEFA Champions League মেচ এয়াৰটেল ডিজিটেল TV -ত Rs17.07/মাহত| চাবস্ক্ৰাইব কৰিবৰ বাবে আপোনাৰ ৰেজিষ্টাৰ মোবাইল নম্বৰৰ পৰা 9154052287 -ত মিচ কল দিয়ক|,1,1,1,0,1,1,1,0,0,1,0,1,4.7,0,182
spam,"আপোনাৰ নিচিনা ক্ৰিকেটপ্ৰেমীৰ বাবে!
উপভোগ কৰক India vs South Africa লাইভ ODI Cricket মেচ Star Sports 1 Hindi -ত এয়াৰটেল ডিজিটেল TV -ৰ সৈতে| ৰিচাৰ্জ কৰক Rs 340-ৰ সৈতে আৰু Rs 355 -ৰ লাভ পাওঁক|ইয়াত ক্লিক কৰক u.airtel.in/sQDT9k",0,1,1,0,1,1,0,0,0,1,0,1,4.61,0,186
spam,"আপোনাৰ দৰে স্মাৰ্ট চেভাৰৰ বাবে সৰ্বশ্ৰেষ্ঠ বিক্ৰেতাৰ প্লেন!পাওক 75GB ডাটা ৰোলঅভাৰৰ সৈতে, Amazonপ্ৰাইম আৰু অধিক মাত্ৰ Rs499 ত! আজিয়েই পোষ্টপেইডলৈ সলনি কৰক i.airtel.in/f4",0,1,1,0,1,1,0,0,0,0,0,0,6.09,0,146
spam,"দৈনিক ডাটা বাৰে বাৰে শেষ হৈ আহিছে নেকি? এয়াৰটেল পোষ্টপেইডৰ সৈতে, আপুনি আপোনাৰ বাকী থকা ডাটা অহা মাহলৈকে বহন কৰিব পাৰে। প্লেন কেৱল Rs399 ৰ পৰা আৰম্ভ হয় i.airtel.in/t7",0,1,0,0,1,1,0,0,0,1,0,0,4.59,0,139
spam,"আপোনাৰ নিচিনা ক্ৰিকেটপ্ৰেমীৰ বাবে!
উপভোগ কৰক New Zealand vs India লাইভ ODI Cricket মেচ DD Sports CH 299 -ত এয়াৰটেল ডিজিটেল TV -ৰ সৈতে| ৰিচাৰ্জ কৰক Rs 340-ৰ সৈতে আৰু Rs 355 -ৰ লাভ পাওঁক|ইয়াত ক্লিক কৰক u.airtel.in/sQDT9k",0,1,1,0,1,1,0,0,0,1,0,1,4.5,0,182
spam,GT VS SRH চেনেল Star Sports 1 Hindi -ত চাবলৈ মিচ নকৰিব! উপভোগ কৰক লাইভ TATA IPL মেচ এয়াৰটেল ডিজিটেল TV -ত Rs22.42/মাহত| চাবস্ক্ৰাইব কৰিবৰ বাবে আপোনাৰ ৰেজিষ্টাৰ মোবাইল নম্বৰৰ পৰা 9154052281 -ত মিচ কল দিয়ক|,1,1,1,0,1,1,1,0,0,1,0,1,4.47,0,169
spam,LSG VS MI চেনেল Star Sports 1 Hindi -ত চাবলৈ মিচ নকৰিব! উপভোগ কৰক লাইভ TATA IPL মেচ এয়াৰটেল ডিজিটেল TV -ত Rs22.42/মাহত| চাবস্ক্ৰাইব কৰিবৰ বাবে আপোনাৰ ৰেজিষ্টাৰ মোবাইল নম্বৰৰ পৰা 9154052281 -ত মিচ কল দিয়ক|,1,1,1,0,1,1,1,0,0,1,0,1,4.47,0,169
spam,"POCO M6 এতিয়া কেৱল Rs8799 ত!
ফ্লিপকাৰ্টত উপলব্ধ POCO M6 5G স্মাৰ্টফোনত এয়াৰটেলৰ পৰা Rs750 লৈকে অফ + 50GB বিনামূলীয়া ডাটা প্ৰাপ্ত কৰক! চৰ্তাৱলী প্ৰযোজ্য। অধিক জানিবলৈ, ক্লিক কৰক i.airtel.in/e/AirFlip",0,1,1,0,1,1,0,0,0,1,0,0,5.62,0,173
spam,এয়াৰটেল য়ুজাৰ্জৰ বাবে এক্সক্লুচিভ অফাঁৰ। আপোনাৰ নতুন Samsung F15 5G স্মাৰ্টফোনত Rs750 -ৰ ৰেহাই লগতে অতিৰিক্ত 50GB ডাটাৰ আনন্দ লওঁক। এইটো এতিয়াই ফ্লিপকাৰ্টৰ পৰা লাভ কৰক! ক্লিক কৰক i.airtel.in/e/AirtelF15,0,1,1,0,1,1,0,0,0,1,0,0,5.72,0,174
spam,"ৱাহ! আপুনি আপোনাৰ পূৰ্বৱৰ্তী এয়াৰটেল পেকৰ সৈতে কোনো অতিৰিক্ত ব্যয় নোহোৱাকৈ 38 GB 5G ডাটা ব্যৱহাৰ কৰিছিল! সীমাহীন 5G উপভোগ কৰা অব্যাহত ৰাখিবলৈ, 2GB/দিন বা অধিক প্ৰদান কৰা পেকৰ সৈতে ৰিচাৰ্জ কৰক। এতিয়াই এক্সপ্লোৰ কৰক https://i.airtel.in/5grcn",0,1,1,1,1,0,0,0,0,1,1,0,5.44,0,207
spam,"আজিৰ ক্ৰিকেট মেচ চাওক, কাইলৈ ৰিচাৰ্জ কৰক! এতিয়াই কোনো অতিৰিক্ত চাৰ্জ নোলোৱাকৈ 1GB ডাটা লোন লওক আৰু মেচবোৰ চাই থাকিব। তৎক্ষণাত পাবলৈ এই SMS ৰ উত্তৰ 1 টাইপ কৰক বা *567*3# ডায়েল কৰক। তথ্যৰ বৈধতা- 1 দিন। আপোনাৰ পৰৱৰ্তী ডাটা টপ-আপৰ পৰা 1GB ডাটা এডজাস্ট কৰা হ'ব।",0,1,1,0,1,0,0,0,0,1,0,1,4.26,0,212
spam,ডাটা সমাপ্ত? বিনা কোনো অতিৰিক্ত মূল্য অবিহনে 1GB ডাটা লোন লাভ কৰক। ডাটাৰ বৈধতা- 1 দিন। লাভ ল’বলৈ ডায়েল কৰক *567*3# নতুবা 1 ৰিপ্লাই কৰক। আপোনাৰ পৰৱৰ্তী ডাটা টপ-আপৰ সৈতে 1GB কমকৈ লাভ কৰক।,0,1,1,0,1,0,0,0,0,1,0,1,4.15,0,152
