type,text,has_phone_number,has_special_chars,has_all_caps_words,has_url,is_mixed_language,has_currency,has_id_code,has_emoji,date/time,has_repeated_words,has_consecutive_special_chars,has_subscriber_code,avg_word_length,has_landline_number,word_length
ham,১ অক্টোবর ৩২তম আন্তর্জাতিক প্রবীন দিবস-২০২২। এ বছরের প্রতিপাদ্য ‘পরিবর্তিত বিশ্বে প্রবীনব্যক্তির সহনশীলতা’ - সমাজকল্যাণ মন্ত্রণালয়।,0,1,0,0,0,0,0,0,1,0,0,1,7.33,0,116
ham,১লা অক্টোবর আন্তর্জাতিক প্রবীণ দিবস-২০২১।,0,1,0,0,0,0,0,0,0,0,0,1,7.0,0,37
ham,আপনার নিকটস্থ কেন্দ্রে ইভিএম এর প্রচারণায় এসে ভোট প্রদান পদ্ধতি সম্পর্কে জানুন - ইসি।,0,1,0,0,0,0,0,0,0,0,0,0,5.38,0,72
ham,"“বঙ্গবন্ধুর দর্শন, সমবায়ে উন্নয়ন” ৪৯তম জাতীয় সমবায় দিবস ২০২০ - সমবায় অধিদপ্তর, পল্লী উন্নয়ন ও সমবায় বিভাগ।",0,1,0,0,0,0,0,0,0,1,0,1,5.25,0,90
ham,"“বঙ্গবন্ধুর দর্শন, সমবায়ে উন্নয়ন”",0,0,0,0,0,0,0,0,0,0,0,0,6.75,0,30
ham,"“বঙ্গবন্ধুর দর্শন, সমবায়ে উন্নয়ন”",0,0,0,0,0,0,0,0,0,0,0,0,6.75,0,30
ham,"“বঙ্গবন্ধুর দর্শন, সমবায়ে উন্নয়ন’’ ৫১তম জাতীয় সমবায় দিবস ২০২২",0,0,0,0,0,0,0,0,0,0,0,1,5.44,0,53
ham,ইভিএম হ্যাক করা বা অনুমোদিত ব্যক্তি ব্যতীত ভোট গ্রহন পরিচালনা করা সম্ভব নয়।-ইসি,0,1,0,0,0,0,0,0,0,1,0,0,5.0,0,67
ham,৪ নভেম্বর ‘জাতীয় সংবিধান দিবস’।,0,0,0,0,0,0,0,0,1,0,0,0,4.8,0,27
ham,"আজ থেকে শুরু হলো ফায়ার সার্ভিস ও সিভিল ডিফেন্স সপ্তাহ-২০২১ । এ বছর সপ্তাহ পালনের প্রতিপাদ্য “মুজিব বর্ষে শপথ করি, দুর্যোগে জীবন-সম্পদ রক্ষা করি”।",0,1,0,0,0,0,0,0,0,1,0,1,5.0,0,122
ham,বাংলাদেশ নৌবাহিনীতে সরাসরি কমিশন্ড অফিসার পদে ‘২০২৩ বি’ ডিইও ব্যাচে নিয়োগ চলছে । অনলাইনে আবেদনের শেষ তারিখ ১০ জানুয়ারি ২০২৩। লগইন করুনঃ www.joinnavy.navy.mil.bd,0,0,0,1,1,0,0,0,1,1,0,1,5.95,0,139
ham,ইভিএম এ ভোট দিতে পছন্দের প্রতীকের পাশের সাদা বোতামটি চাপুন ও ভোট নিশ্চিত করতে সবুজ বোতামটি চাপুন-ইসি,0,1,0,0,0,0,0,0,0,1,0,0,4.88,0,84
ham,"১লা ডিসেম্বর থেকে শুরু হচ্ছে ১০০ দিনের বঙ্গবন্ধু শেখ মুজিব কুইজ। প্রতিদিন ১০০ জন করে মোট দশ হাজার বিজয়ী। জিতে নিন ল্যাপটপ, স্মার্টফোন এবং ইন্টারনেট ডাটা প্যাক। অংশ নিতে এখুনি ক্লিক করুন https://bit.ly/3pZsYkP",0,1,0,1,1,0,0,0,0,1,1,0,5.06,0,176
ham,এসএমই ফাউন্ডেশন আয়োজিত জাতীয় এসএমই পণ্যমেলা আগারগাঁও বিআইসিসিতে ২৪ নভেম্বর-০৩ ডিসেম্বর সকাল ১০টা-রাত্র ৮টা পর্যন্ত চলবে। ক্ষুদ্র ও মাঝারি উদ্যোক্তাদের উৎপাদিত পণ্য ক্রয়ের জন্য সপরিবারে আমন্ত্রিত।,0,1,0,0,0,0,0,0,1,1,0,0,6.38,0,170
ham,সশস্ত্র বাহিনী বিভাগের আয়োজনে স্বাধীনতা যুদ্ধ চলাকালীন ধারণকৃত দুর্লভ ছবিসমূহের প্রদর্শনী চলবে ২৫ হতে ২৭ নভেম্বর ২০২১। স্থান-বাংলাদেশ শিল্পকলা একাডেমী। সকলের জন্য উন্মুক্ত।,0,1,0,0,0,0,0,0,1,0,0,1,6.35,0,150
ham,বিটিআরসি কর্তৃক টেলিযোগাযোগ সেবা বিষয়ক গণশুনানি চট্টগ্রামস্থ Radisson হোটেলে আগামী ০৮ ডিসেম্বর ২০২২ সকাল ১১:০০ ঘটিকায় অনুষ্ঠিত হবে। অংশগ্রহণের রেজিস্ট্রেশন লিংকঃ https://cutt.ly/MMMjbSM,0,1,0,1,1,0,0,0,1,0,1,1,7.14,0,164
ham,"‘‘এন্টিবায়োটিক ব্যবহারে সচেতন হই, সকলে মিলে এন্টিমাইক্রোবিয়াল রেজিস্ট্যান্স প্রতিরোধ করি- সিডিসি, স্বাস্থ্য অধিদপ্তর।",0,1,0,0,0,0,0,0,0,0,0,0,7.62,0,105
ham,“২৩ নভেম্বর ২০২২ বাংলাদেশ আর্মি স্টেডিয়ামে যুব ও ক্রীড়া মন্ত্রণালয়ের আয়োজনে BIUSC এর সমাপনী অনুষ্ঠানে প্রধান অতিথি হিসেবে উপস্থিত থাকবেন মাননীয় প্রধানমন্ত্রী শেখ হাসিনা।’’ ,0,0,1,0,1,0,0,0,1,0,0,1,6.0,0,149
ham,"এন্টিবায়োটিক ব্যবহারে সচেতন হই, সকলে মিলে এন্টিমাইক্রোবিয়াল রেজিস্ট্যান্স প্রতিরোধ করি- সিডিসি, স্বাস্থ্য অধিদপ্তর।",0,1,0,0,0,0,0,0,0,0,0,0,7.62,0,103
ham,ইভিএমে আঙ্গুলের ছাপ যাচাই করা হয় বিধায় দ্বিতীয়বার ভোট প্রদান বা একজনের ভোট অন্যজনেরর পক্ষে প্রদান সম্ভব নয়-ইসি,0,1,0,0,0,0,0,0,0,1,0,0,5.11,0,93
ham,বিমান বাহিণীর জংগী বিমান কুতুবদিয়া ফায়ারিং রেঞ্জে ০১ হতে ০৩ নভেম্বর ২২ পর্যন্ত গোলাবর্ষণ করবে। এ সময় সকলকে উক্ত ফায়ারিং এলাকা পরিহার করার জন্য অনুরোধ করা হল।,0,0,0,0,0,0,0,0,1,1,0,0,4.78,0,131
ham,"“আমার রক্ত শত ধমনীতে আনবে নতুন প্রাণ, অন্ধ আঁখিতে রশ্মি জ্বালাতে করবো দৃষ্টিদান”।",0,0,0,0,0,0,0,0,0,0,0,0,5.0,0,69
ham,"১৯-২১ নভেম্বর ২০২০ সারাদেশ ব্যাপী ফায়ার সপ্তাহ ২০২০ উদযাপিত হবে। এ বছর সপ্তাহের প্রতিপাদ্য হচ্ছে “প্রশিক্ষণ পরিকল্পনা প্রস্তুতি, দুর্যোগ মোকাবিলায় আনবে গতি”।",0,1,0,0,0,0,0,0,1,1,0,1,5.91,0,136
ham,"হোক সচেতনতার বিস্তার, চাই এন্টিবায়োটিক রেজিস্ট্যান্স থেকে নিস্তার। - সিডিসি, স্বাস্থ্য অধিদপ্তর",0,1,0,0,0,0,0,0,0,0,0,0,7.36,0,85
ham,"“বিশ্ব এন্টিমাইক্রোবিয়াল সচেতনতা সপ্তাহের অঙ্গীকার, এন্টিবায়োটিক ও অন্যান্য জীবানুরোধী ঔষধের সতর্ক ব্যবহার” - রোগ নিয়ন্ত্রণ শাখা, স্বাস্থ্য অধিদপ্তর।",0,1,0,0,0,0,0,0,0,0,0,0,7.41,0,132
ham,শেখ হাসিনা সরকারের সাফল্য :,0,1,0,0,0,0,0,0,0,0,0,0,5.5,0,23
ham,"“আজ ১৪ নভেম্বর “বিশ্ব ডায়াবেটিস দিবস”। দিবসটির এবারের প্রতিপাদ্য, “ডায়াবেটিস-সেবা নিতে আর দেরি নয়”। কোভিড-১৯ ও ডায়াবেটিস সম্পর্কে জানতে ভিজিট করুনঃ www.diabetes-covid19.org",0,1,0,1,1,0,0,0,1,1,0,0,6.27,0,151
ham,আজ ১৪ই নভেম্বর “বিশ্ব ডায়াবেটিস দিবস”। দিবসটির এবারের প্রতিপাদ্য “ডায়াবেটিস-সেবায় পার্থক্য আনতে পারে নার্সরাই”। কোভিড-১৯ ও ডায়াবেটিস সম্পর্কে জানতে ভিজিট করুনঃ diabetes-covid19.org,0,1,0,0,1,0,0,0,1,1,0,0,6.77,0,159
ham,বাংলাদেশ নৌবাহিনীতে ডিপ্লোমা সম্পন্নকারী প্রার্থীদের ডাইরেক্ট এন্ট্রি আর্টিফিসার-৪র্থ হিসেবে নিয়োগ চলছে। ভিজিট করুন: www.joinnavy.navy.mil.bd,0,1,0,1,1,0,0,0,0,0,0,0,8.64,0,128
ham,ইভিএম এ ভোট দিতে পছন্দের প্রতীকের পাশে সাদা বোতামটি চাপুন ও ভোট নিশ্চিত করতে সবুজ বোতামটি চাপুন - ইসি।,0,1,0,0,0,0,0,0,0,1,0,0,4.56,0,84
ham,"ডিজিটাল সেন্টারের ১০ বছর পূর্তিতে প্রশাসন, উদ্যোক্তা, জনপ্রতিনিধি, সেবাগ্রহীতাসহ সকলকে অভিনন্দন। ডিজিটাল সেন্টারে আসুন, সেবা নিন। এটুআই।",0,0,0,0,0,0,0,0,0,1,0,0,6.65,0,120
ham,ইভিএম এর প্রকৃত উদ্দেশ্য জাল ভোট বন্ধ করে জনগণের ভোটাধিকার সুনিশ্চিত করা-ইসি,0,1,0,0,0,0,0,0,0,0,0,0,5.33,0,65
ham,০১ নভেম্বর ২০২২ জাতীয় যুব দিবস। এবারের প্রতিপাদ্য-,0,1,0,0,0,0,0,0,1,0,0,1,5.12,0,43
ham,"“দক্ষ যুব সমৃদ্ধ দেশ, বঙ্গবন্ধুর বাংলাদেশ”। যুব উন্নয়ন অধিদপ্তর, যুব ও ক্রীড়া মন্ত্রণালয়।",0,0,0,0,0,0,0,0,0,1,0,0,5.46,0,77
ham,“দস্যুমুক্ত সুন্দরবন দিবস ২০২১”,0,0,0,0,0,0,0,0,0,0,0,1,6.5,0,28
ham,"১ নভেম্বর ২০২০ বঙ্গবন্ধু জাতীয় যুব দিবস। এবারের প্রতিপাদ্য - “মুজিববর্ষের আহ্বান, যুব কর্মসংস্থান”। যুব উন্নয়ন অধিদপ্তর, যুব ও ক্রীড়া মন্ত্রণালয়",0,1,0,0,0,0,0,0,1,1,0,1,5.85,0,124
ham,"যুব ও ক্রীড়া মন্ত্রণালয় কর্তৃক আগামী ১১ মে, ২০২২ সকাল ০৯ টায় ওসমানী স্মৃতি মিলনায়তনে জাতীয় ক্রীড়া পুরস্কার প্রদান করা হবে। অনুষ্ঠানে প্রধান অতিথি হিসেবে উপস্থিত থাকবেন মাননীয় প্রধানমন্ত্রী শেখ হাসিনা।",0,0,0,0,0,0,0,0,1,1,0,1,5.39,0,170
ham,"সরকার কোভিডের বিস্তার রোধে লকডাউন দিয়েছে। এ সময়ে ঘরে থেকেই মোবাইল রিচার্জ, গ্যাস, বিদ্যুৎ, পানি, ইন্টারনেটসহ সকল পরিষেবার বিল চার্জ ফ্রি-তে পরিশোধ করুন মোবাইল ফিনান্সিয়াল সার্ভিস এর মাধ্যমে।",0,1,0,0,0,0,0,0,0,1,0,0,5.57,0,163
ham,"সবাই মিলে সঞ্চয় করি, স্মার্ট বাংলাদেশ গড়ি -এ প্রতিপাদ্য নিয়ে আগামী ৫-১১মে, ২০২৪ খ্রিঃ পর্যন্ত দেশব্যাপী উদ্‌যাপিত হবে সঞ্চয় অভিযান-২০২৪। জাতীয় সঞ্চয় অধিদপ্তর।",0,1,0,0,0,0,0,0,0,1,0,1,5.57,0,136
ham,"“নিরাপত্তার জন্য আপনার ব্যবহৃত ই-মেইল, ফেসবুক, ইউটিউব, টুইটার ও মোবাইল হিসাব ইত্যাদির পাসওয়ার্ড, পিন, ওটিপি কাউকে দেবেন না। নইলে ব্যক্তিগত তথ্য চুরি ও আর্থিক ক্ষতি হতে পারে - ডাক ও টেলিযোগাযোগ বিভাগ",0,1,0,0,0,0,0,0,0,1,0,0,5.1,0,167
ham,"আজ ৩১ মে, ২০২৪ ‘বিশ্ব তামাকমুক্ত দিবস’। এবারের প্রতিপাদ্য: ‘তামাক কোম্পানির হস্তক্ষেপ প্রতিহত করি, শিশুদের সুরক্ষা নিশ্চিত করি’। - জাতীয় তামাক নিয়ন্ত্রণ সেল, স্বাস্থ্য সেবা বিভাগ, স্বাপকম।",0,1,0,0,0,0,0,0,1,1,0,1,5.73,0,162
ham,"“তামাকমুক্ত পরিবেশ, সুস্বাস্থ্যের বাংলাদেশ”। জাতীয় তামাক নিয়ন্ত্রণ সেল, স্বাস্থ্য সেবা বিভাগ, স্বাস্থ্য ও পরিবার কল্যাণ মন্ত্রণালয়।",0,0,0,0,0,0,0,0,0,1,0,0,6.81,0,116
ham,আসুন আমরা প্রতিজ্ঞা করি,0,0,0,0,0,0,0,0,0,0,0,0,5.0,0,20
ham,“বাংলাদেশ নৌবাহিনীতে অফিসার ক্যাডেট পদে নিয়োগ চলছে। ভিজিট করুনঃ www.joinnavy.navy.mil.bd,0,0,0,1,1,0,0,0,0,0,0,0,7.3,0,79
ham,বাংলাদেশ নৌবাহিনীতে অফিসার ক্যাডেট পদে নিয়োগ চলছে। ভিজিট করুনঃ www.joinnavy.navy.mil.bd,0,0,0,1,1,0,0,0,0,0,0,0,7.3,0,78
ham,বাংলাদেশ নৌবাহিনীতে কমিশন্ড অফিসার পদে নিয়োগ চলছে। ভিজিট করুনঃ www.joinnavy.mil.bd,0,0,0,1,1,0,0,0,0,0,0,0,6.9,0,73
ham,২৯ মে আন্তর্জাতিক জাতিসংঘ শান্তিরক্ষী দিবস। শান্তিরক্ষা মিশনে বাংলাদেশের ৩৪ তম বর্ষপূর্তিতে শান্তিরক্ষীদের সীমাহীন অবদান জাতি বিনম্র শ্রদ্ধা ও কৃতজ্ঞচিত্তে স্বরণ করছে।,0,0,0,0,0,0,0,0,1,0,0,0,6.55,0,146
ham,“২৯ মে আন্তর্জাতিক জাতিসংঘ শান্তিরক্ষী দিবস। শান্তিরক্ষা মিশনে বাংলাদেশের ৩৩তম বর্ষপূর্তিতে শান্তিরক্ষীদের সীমাহীন অবদান জাতি বিনম্র শ্রদ্ধা ও কৃতজ্ঞচিত্তে স্মরণ করছে।”,0,0,0,0,0,0,0,0,1,0,0,0,6.86,0,148
ham,২৯ মে আন্তর্জাতিক জাতিসংঘ শান্তিরক্ষী দিবস। শান্তিরক্ষা মিশনে বাংলাদেশের ৩৩তম বর্ষপূর্তিতে শান্তিরক্ষীদের সীমাহীন অবদান জাতি বিনম্র শ্রদ্ধা ও কৃতজ্ঞচিত্তে স্মরণ করছে।,0,0,0,0,0,0,0,0,1,0,0,0,6.86,0,146
ham,"‘মা ও শিশুর জীবন বাঁচাতে, স্বাস্থ্য কেন্দ্রে হবে যেতে’ প্রতিপাদ্যে আজ সারা দেশে পালিত হচ্ছে ‘নিরাপদ মাতৃত্ব দিবস ২০২২’-স্বাস্থ্য ও পরিবার কল্যাণ মন্ত্রণালয়।",0,1,0,0,0,0,0,0,0,1,0,1,5.52,0,134
ham,"“করোনাকালে গর্ভকালীন সেবা নিন, মাতৃ ও শিশু মৃত্যু রোধ করুন” প্রতিপাদ্যে আজ সারা দেশে পালিত হচ্ছে ‘নিরাপদ মাতৃত্ব দিবস ২০২১’ - স্বাস্থ্য ও পরিবার কল্যাণ মন্ত্রণালয়।",0,1,0,0,0,0,0,0,0,1,0,1,5.24,0,138
ham,“বিমান বাহিনীতে এমওডিসি (এয়ার) পদে নিয়োগ চলছে। বিস্তারিতঃ www.joinbangladeshairforce.mil.bd”,0,1,0,1,1,0,0,0,0,0,0,0,8.44,0,84
ham,বিমান বাহিনীতে এমওডিসি (এয়ার) পদে নিয়োগ চলছে। বিস্তারিতঃ www.joinbangladeshairforce.mil.bd,0,1,0,1,1,0,0,0,0,0,0,0,8.44,0,82
ham,ফোন করেই ভূমি সেবা! পৃথিবীর যেকোন প্রান্ত থেকে যেকোন সময় কল করুন ১৬১২২ নম্বরে আর ঘরে বসেই পেয়ে যান ভূমি বিষয়ক সকল সেবা একটি কলে।,1,1,0,0,0,0,0,0,0,1,0,1,4.08,1,104
ham,বিমান বাহিনীর জঙ্গী বিমান কুতুবদিয়া ফায়ারিং রেঞ্জে ২৩ মে- ০৯ জুন ২২ পর্যন্ত গোলাবর্ষণ করবে। এ সময় সকলকে উক্ত ফায়ারিং এলাকা পরিহার করার জন্য অনুরোধ করা হলো।,0,1,0,0,0,0,0,0,1,1,0,0,4.7,0,130
ham,‘সঞ্চয় অর্থনৈতিক ও সামাজিক নিরাপত্তার প্রতীক’-এ পতিপাদ্য নিয়ে আগামী ২২ মে হতে ২৮ মে ২০২২ খ্রিঃ পর্যন্ত দেশব্যাপী উদযাপিত হবে সঞ্চয় অভিযান ২০২২।-জাতীয় সঞ্চয় অধিদপ্তর,0,1,0,0,0,0,0,0,1,1,0,1,5.4,0,140
ham,"আজ ২০ মে ২০২৪, বিশ্ব মেট্রোলজি দিবস। এবারের প্রতিপাদ্য- ‘টেকসই ভবিষ্যৎ বিনির্মাণে আজকের পরিমাপ’, বিএসটিআই, শিল্প মন্ত্রণালয়।",0,1,0,0,0,0,0,0,1,0,0,1,5.88,0,108
ham,"‘‘২০ মে, ২০২২ ‘বিশ্ব মেট্রোলজি দিবস’। দিবসটির প্রতিপাদ্য হচ্ছে ‘ডিজিটাল যুগে পরিমাপ’। বিএসটিআই, শিল্প মন্ত্রণালয়।’’",0,0,0,0,0,0,0,0,1,0,0,1,5.87,0,101
ham,২০ মে ২০২২ হতে সারাদেশে ভোটার তালিকা হালনাগাদ শুরু হচ্ছে। আপনার জন্ম ১ জানুয়ারি ২০০৭ বা পূর্বে হলে এবং ভোটার না হয়ে থাকলে নির্ভুল তথ্য দিয়ে ভোটার হোন- ইসি।,0,1,0,0,0,0,0,0,1,1,0,1,4.28,0,127
ham,"২০ মে, ২০২২ ‘বিশ্ব মেট্রোলজি দিবস’। দিবসটির প্রতিপাদ্য হচ্ছে ‘ডিজিটাল যুগে পরিমাপ’। বিএসটিআই, শিল্প মন্ত্রণালয়।",0,0,0,0,0,0,0,0,1,0,0,1,5.87,0,97
ham,"“২০ মে, ২০২১ ‘বিশ্ব মেট্রোলজি দিবস&apos;। দিবসটির প্রতিপাদ্য হচ্ছে ‘সুস্বাস্থ্যের জন্য পরিমাপ’।",0,1,0,0,1,0,0,0,1,0,0,1,6.25,0,84
ham,"২০ মে, ২০২১ ‘বিশ্ব মেট্রোলজি দিবস&apos;। দিবসটির প্রতিপাদ্য হচ্ছে ‘সুস্বাস্থ্যের জন্য পরিমাপ’।",0,1,0,0,1,0,0,0,1,0,0,1,6.25,0,83
ham,"২৩-২৯ মে ২০২৪ জাতীয় কৃমি নিয়ন্ত্রণ সপ্তাহে ৫-১৬ বছর বয়সী সকল শিশুকে ভরাপেটে ১ ডোজ কৃমি নাশক ঔষধ খাওয়ান - স্বাস্থ্য অধিদপ্তর, স্বাস্থ্য ও প.ক. মন্ত্রণালয়।",0,1,0,0,0,0,0,0,1,1,0,1,4.84,0,128
ham,"নৌ নিরাপত্তা সপ্তাহ ১৯ মে হতে সপ্তাহব্যাপী। প্রতিপাদ্যঃ‘প্রশিক্ষিত জনবল ও নিরাপদ জলযান, নৌ নিরাপত্তায় রাখবে অবদান’- নৌ-পরিবহন অধিদপ্তর।",0,1,0,0,0,0,0,0,1,1,0,0,6.17,0,118
ham,“১১তম জাতীয় ক্ষুদ্র ও মাঝারি শিল্প পণ্য মেলা-২০২৪ বঙ্গবন্ধু আন্তর্জাতিক সম্মেলন কেন্দ্রে ১৯-২৫ মে ২০২৪ প্রতিদিন সকাল ১০.০০ টা হতে রাত ৮:০০ টা পর্যন্ত চলবে। আপনি সপরিবারে আমন্ত্রিত। -শিল্প মন্ত্রণালয়।”,0,1,0,0,0,0,0,0,1,1,0,1,5.37,0,171
ham,‘বাংলাদেশ বিমান বাহিনীতে ৮৭ বাফা কোর্সে অফিসার ক্যাডেট নিয়োগ চলছে। ভিজিট করুনঃ www.joinbangladeshairforce.mil.bd’,0,0,0,1,1,0,0,0,0,0,0,0,7.31,0,101
ham,বাংলাদেশ বিমান বাহিনীতে ৮৭ বাফা কোর্সে অফিসার ক্যাডেট নিয়োগ চলছে। ভিজিট করুনঃ www.joinbangladeshairforce.mil.bd,0,0,0,1,1,0,0,0,0,0,0,0,7.31,0,99
ham,‘বয়োজ্যেষ্ঠ ব্যক্তি এবং স্বাস্থ্যসম্মত বার্ধক্যের জন্য ডিজিটাল প্রযুক্তি’ প্রতিপাদ্যকে সামনে রেখে আজ ১৭ মে পালিত হচ্ছে বিশ্ব টেলিযোগাযোগ ও তথ্য সংঘ দিবস ২০২২ - ডাক ও টেলিযোগাযোগ বিভাগ।,0,1,0,0,0,0,0,0,1,1,0,1,5.67,0,157
ham,১৭ মে বিশ্ব টেলিযোগাযোগ দিবসের শুভেচ্ছা জানাই। আসুন আমরা জনসেবার সকল খাতকে ‘ডিজিটাল রুপান্তর’ করি।,0,0,0,0,0,0,0,0,1,0,0,0,5.33,0,84
ham,১৭ মে বিশ্ব টেলিযোগাযোগ দিবসের শুভেচ্ছা জানাই। আসুন আমরা জনসেবার সকল খাতকে ‘ডিজিটাল রুপান্তর’ করি।,0,0,0,0,0,0,0,0,1,0,0,0,5.33,0,84
