type,text,has_phone_number,has_special_chars,has_all_caps_words,has_url,is_mixed_language,has_currency,has_id_code,has_emoji,date/time,has_repeated_words,has_consecutive_special_chars,has_subscriber_code,avg_word_length,has_landline_number,word_length
spam,মাই রবি অ্যাপে ২৭জিবি+৬৫০মিঃ+২৮৳ ক্যাশব্যাক ৫৫০৳।ক্লিক cutt.ly/b550,0,1,0,0,1,0,0,0,0,0,0,0,8.0,0,61
spam,মাই রবি অ্যাপে ৪০জিবি+৮০০মিঃ+৩২৳ ক্যাশব্যাক ৩০দিন ৬৩০৳ cutt.ly/c630,0,1,0,0,1,0,0,0,0,0,0,0,7.0,0,60
spam,অ্যাপে ৪০জিবি+৮০০মিঃ+৩২৳ ক্যাশব্যাক ৬৩০৳ দুর্দান্ত অফার cutt.ly/c630,0,1,0,0,1,0,0,0,0,0,0,0,8.29,0,62
spam,অ্যাপে দুর্দান্ত অফার ৪০জিবি+৮০০মিঃ+৩২৳ ক্যাশব্যাক ৬৩০৳ cutt.ly/c630,0,1,0,0,1,0,0,0,0,0,0,0,8.29,0,62
spam,মাতৃভাষা দিবসে অ্যাপে ৪০জিবি+৮০০মিঃ+৩২৳ ক্যাশব্যাক ৬৩০৳ cutt.ly/c630,0,1,0,0,1,0,0,0,0,0,0,0,8.29,0,62
spam,অ্যাপে দুর্দান্ত অফার! ৪০জিবি+৮০০মিঃ+৩২৳ ক্যাশব্যাক ৬৩০৳ cutt.ly/c630,0,1,0,0,1,0,0,0,0,0,0,0,8.29,0,63
spam,৪০জিবি+৮০০মিঃ+৩২৳ ক্যাশব্যাক ৬৩০৳ মাই রবি অ্যাপে।ক্লিক cutt.ly/c630,0,1,0,0,1,0,0,0,0,0,0,0,8.0,0,61
spam,রবি অ্যাপে ফাল্গুন অফার ৪০জিবি+৮০০মিঃ+৩২৳ ক্যাশব্যাক ৬৩০৳ cutt.ly/c630,0,1,0,0,1,0,0,0,0,0,0,0,7.38,0,63
spam,আজ রবি অ্যাপে ৪০জিবি+৮০০মিঃ+৩২৳ ক্যাশব্যাক ৩০দিন ৬৩০৳ cutt.ly/c630,0,1,0,0,1,0,0,0,0,0,0,0,6.88,0,59
spam,ট৪১: ১.৪GB ৩দিন! ট৭৫: ২.১GB ৭দিন! রবিMyPlan-এ! cutt.ly/myplan,0,1,1,0,1,0,0,0,1,0,0,0,5.5,0,54
spam,সারামাস কাটুক নিশ্চিন্তে।রবি অ্যাপে ৪০জিবি+৮০০মিঃ+৩২৳ ক্যাশব্যাক ৩০দিন ৬৩০৳।ক্লিক cutt.ly/c630,0,1,0,0,1,0,0,0,0,0,0,0,8.89,0,86
spam,রবি অ্যাপের সাথে মেতে উঠুন সেরা ইন্টারনেট উৎসবে। ২৫জিবি+৬০০মিঃ+২৭৳ ক্যাশব্যাক ৫৩০৳।ক্লিক cutt.ly/d530,0,1,0,0,1,0,0,0,0,0,0,0,7.0,0,90
spam,মাই রবি অ্যাপে আজ ৫জিবি বোনাস সহ ২৫জিবি+৬০০মিঃ+২৭৳ ক্যাশব্যাক ৫৩০৳।কিনতে ক্লিক cutt.ly/d530,0,1,0,0,1,0,0,0,0,0,0,0,6.25,0,80
spam,রবি অ্যাপে বছরের শেষ ধামাকা অফার।[আজ ১০জিবি ৫০মিঃ বোনাস] ৩৫জিবি+৮০০মিঃ+৩০৳ ক্যাশব্যাক ৬০০৳। কিনতে ক্লিক cutt.ly/c600,0,1,0,0,1,0,0,0,0,0,0,0,6.27,0,102
spam,রবি অ্যাপে ধামাকা অফার। [আজ ১০জিবি ৫০মিঃ বোনাস] ৩৫জিবি+৮০০মিঃ+৩০৳ ক্যাশব্যাক ৬০০৳। কিনতে ক্লিক cutt.ly/c600,0,1,0,0,1,0,0,0,0,0,0,0,6.14,0,94
spam,রবি অ্যাপে ইন্টারনেট উৎসব।২৫জিবি+৬০০মিঃ+২৭৳ ক্যাশব্যাক ৫৩০৳।ক্লিক cutt.ly/d530,0,1,0,0,1,0,0,0,0,0,0,0,9.43,0,72
spam,বিজয়ের উল্লাসে মেতে উঠুন মাই রবি অ্যাপে।২৫জিবি+৬০০মিঃ+২৭৳ ক্যাশব্যাক ৫৩০৳।ক্লিক cutt.ly/d530,0,1,0,0,1,0,0,0,0,0,0,0,7.7,0,83
spam,জাস্ট একটা ট্যাপে Appsolute Celebration শুরু মাই রবি অ্যাপে [২৫জিবি+৬০০মিঃ+২৭৳ ক্যাশব্যাক] ৫৩০৳।ক্লিক cutt.ly/d530,0,1,0,0,1,0,0,0,0,0,0,0,7.31,0,102
spam,জাস্ট একটা ট্যাপে Appsolute Celebration শুরু মাই রবি অ্যাপে।[আজ ১০জিবি ৫০মিঃ বোনাস] ৩৫জিবি+৮০০মিঃ+৩০৳ ক্যাশব্যাক ৬০০৳। কিনতে ক্লিক cutt.ly/c600,0,1,0,0,1,0,0,0,0,0,0,0,6.56,0,126
spam,ছুটির দিনে রবি অ্যাপে ৩২৳ ক্যাশব্যাক+৪০জিবি+৮০০মিঃ ৬৩০৳ cutt.ly/c630,0,1,0,0,1,0,0,0,0,0,0,0,7.12,0,61
spam,আজ রবি অ্যাপে ৩২৳ ক্যাশব্যাক সহ ৪০জিবি+৮০০মিঃ ৬৩০৳।ক্লিক cutt.ly/c630,0,1,0,0,1,0,0,0,0,0,0,0,6.33,0,61
spam,৩২৳ ক্যাশব্যাক সহ আজ রবি অ্যাপে ৪০জিবি+৮০০মিঃ ৬৩০৳।ক্লিক cutt.ly/c630,0,1,0,0,1,0,0,0,0,0,0,0,6.33,0,61
spam,অ্যাপে লকডাউনের আগেই সেরা অফার কিনুন ৪০জিবি+৮০০মিঃ ৬৩০৳ cutt.ly/c630,0,1,0,0,1,0,0,0,0,0,0,0,6.33,0,60
spam,রবি অ্যাপে ৩০জিবি+৮০০মিঃ ৩০দিন ৫৫০৳ ধামাকা অফার।ক্লিক cutt.ly/cor,0,1,0,0,1,0,0,0,0,0,0,0,6.75,0,58
spam,রবি অ্যাপে [৩০জিবি+৮০০মিঃ] ৩০দিন ৫৫০৳ ধামাকা অফার।ক্লিক cutt.ly/cor,0,1,0,0,1,0,0,0,0,0,0,0,6.75,0,60
spam,আজ রবি অ্যাপে ৩০জিবি+৮০০মিঃ ৩০দিন ৫৫০৳ ধামাকা অফার।ক্লিক cutt.ly/cor,0,1,0,0,1,0,0,0,0,0,0,0,6.22,0,60
spam,ধামাকা অফার রবি অ্যাপে! ৩০জিবি+৮০০মিঃ ৩০দিন ৫৫০৳।ক্লিক cutt.ly/cor,0,1,0,0,1,0,0,0,0,0,0,0,6.75,0,59
spam,"রবি অ্যাপে বিকাশ, কার্ড পেমেন্টে ৩০জিবি+৮০০মিঃ ৫৫০৳।ক্লিক cutt.ly/inr",0,1,0,0,1,1,0,0,0,0,0,0,7.12,0,62
spam,লকডাউনের আগেই রবি অ্যাপে কিনুন ৩০জিবি+৮০০মিঃ ৫৫০৳।ক্লিক cutt.ly/inr,0,1,0,0,1,1,0,0,0,0,0,0,7.0,0,60
spam,"আজ আস্থা দিয়ে বিকাশ-এ ৳৪,৫০০ পাঠিয়ে নিন ৳১০০ কুপন! tinyurl.com/BBLBFO",0,1,1,1,1,0,0,0,0,0,0,0,5.5,0,60
spam,"২ মাস Chorki ফ্রি! আস্থায় ৳৬,০০০ ওয়ালেট ট্রান্সফারে tinyurl.com/BBLAW2",0,1,1,1,1,0,0,0,0,0,0,0,6.44,0,62
spam,"ব্র্যাক ব্যাংক ক্রেডিট কার্ডের মাধ্যমে ৫,০০০ টাকার কেনাকাটায় ১,০০০ বোনাস রিওয়ার্ড পয়েন্ট| বিস্তারিত- tinyurl.com/BBLSep3",0,1,0,1,1,1,0,0,1,0,0,0,7.21,0,107
spam,"টাকা পাঠান কম খরচে! বিকাশ থেকে ব্র্যাক ব্যাংক একাউন্টে টাকা পাঠান, হাজারে মাত্র ১০ টাকা খরচে। বিস্তারিত: tinyurl.com/Bblbks2",0,1,0,1,1,1,0,0,1,1,0,0,5.61,0,107
spam,আস্থায় তিন ক্লিকে ক্রেডিট কার্ডের বিল পেমেন্ট করুন tinyurl.com/BBLCCB,0,1,1,1,1,0,0,0,0,0,0,0,6.56,0,61
spam,"২ মাস Chorki ফ্রি! ঠিক ৳৫০,০০০ A/C টু A/C পাঠানোতে tinyurl.com/WoW-09",0,1,0,1,1,0,0,0,0,1,0,0,4.73,0,59
spam,রবি ও এয়ারটেলে চার্জ ফ্রি রিচার্জ আস্থা অ্যাপে tinyurl.com/asthadnld,0,1,0,1,1,0,0,0,0,0,0,0,6.44,0,60
spam,আস্থা অ্যাপে ব্যাংকিং চালু রাখতে https://onelink.to/bgqm6h লিংকে ক্লিক করে আপডেট করে লগইন করুন।,0,1,0,1,1,0,0,0,0,1,1,0,5.92,0,83
spam,রবি ও এয়ারটেলে মোবাইল রিচার্জ করুন আস্থা অ্যাপে tinyurl.com/asthadnld,0,1,0,1,1,0,0,0,0,0,0,0,6.56,0,61
spam,বিকাশ টু ব্র্যাক ব্যাংক টাকা পাঠান হাজারে ৳১০ খরচে। tinyurl.com/bblbaf,0,1,0,1,1,1,0,0,0,0,0,0,5.8,0,61
spam,বিকাশে টাকা পাঠান ব্র্যাক ব্যাংক আস্থা অ্যাপ থেকে tinyurl.com/BBLAW1,0,1,1,1,1,1,0,0,0,0,0,0,6.44,0,60
spam,আস্থায় ডাবল বোনাস অফার! ২ জিবি ও ১ বছর Chorki ফ্রি! tinyurl.com/bblabd,0,1,0,1,1,0,0,0,0,0,0,0,4.58,0,59
spam,"বিকাশ-এ ৫০০ টাকা ক্যাশব্যাক! আস্থা অ্যাপ থেকে বিকাশ-এ ৬,৫০০+ টাকা পাঠালেই প্রতিঘন্টায় ১ম ৫ জনের জন্য। বিস্তারিত: tinyurl.com/BKBBL01",0,1,1,1,1,1,0,0,1,1,0,0,5.89,0,115
spam,আস্থা অ্যাপে FD বা DPS খুলুন খুব সহজেই https://tinyurl.com/BBLFDO,0,1,1,1,1,0,0,0,0,0,1,0,5.78,0,57
spam,"[BRAC Bank] টাকা পাঠান কম খরচে! বিকাশ থেকে ব্র্যাক ব্যাংক একাউন্টে টাকা পাঠান, হাজারে মাত্র ১০ টাকা খরচে। বিস্তারিত:tinyurl.com/Bblbks2",0,1,1,1,1,1,0,0,1,1,0,0,5.74,0,117
spam,We have experienced a system problem and are unable to provide some banking services now. Our ATMs are operational. We expect to have our systems up &amp; running shortly. We will keep you updated. We apologise for the inconvenience. Thank you for your patience &amp; understanding.,0,1,0,0,0,1,0,0,0,1,0,0,4.93,0,237
spam,ব্রেস্ট ক্যান্সার সচেতনতা মাসে তারা কার্ড দিয়ে স্বনামধন্য হাসপাতালে হেলথ চেকআপে পাচ্ছেন ডিসকাউন্ট। tinyurl.com/BBLCAM,0,1,1,1,1,1,0,0,0,0,0,0,7.21,0,104
spam,ব্রেস্ট ক্যান্সার চেকআপে TARA কার্ডে বিশেষ ছাড়। tinyurl.com/bblbaw,0,1,1,1,1,0,0,0,0,0,0,0,7.0,0,59
spam,হাজারে মাত্র ৳১০ খরচে বিকাশ থেকে ব্র্যাক ব্যাংক অ্যাকাউন্টে টাকা পাঠান,0,0,0,0,0,1,0,0,0,0,0,0,5.45,0,60
spam,"আজ আস্থা দিয়ে বিকাশ-এ ৳৪,৫০০ পাঠিয়ে নিন ৳১০০ কুপন! tinyurl.com/BkF1122",0,1,0,1,1,0,0,0,0,0,0,0,5.6,0,61
spam,বিশ্বকাপে ব্রাজিলের খেলা দেখুন আস্থায় লগইন করে tinyurl.com/BBLBW1,0,1,1,1,1,0,0,0,0,0,0,0,7.0,0,58
spam,ঝামেলা ছাড়াই আস্থা অ্যাপে FD/DPS খুলুন মুহূর্তেই! tinyurl.com/bblasd,0,1,1,1,1,0,0,0,0,0,0,0,7.12,0,61
spam,International online transaction up to $300 is auto-enabled for your BBL Credit Card. Ensure proper endorsement for seamless transaction. To disable dial 16221.,1,1,1,0,0,1,0,0,0,1,0,1,5.78,1,138
spam,বিশ্বকাপে আর্জেন্টিনার খেলা দেখুন আস্থায় লগইন করে tinyurl.com/BBLAS1,0,1,1,1,1,0,0,0,0,0,0,0,7.38,0,61
spam,ফুটবল বিশ্বকাপ লাইভ দেখতে আস্থা অ্যাপে লগইন করুন tinyurl.com/BBLAT4,0,1,1,1,1,0,0,0,0,0,0,0,6.33,0,59
spam,Welcome to BRAC Bank stall at Chattogram Rehab Fair (18-21 Nov &apos;21). Allow us to help you book your dream home with attractive home loan facilities.,0,1,1,0,0,0,0,0,1,1,0,0,4.65,0,128
spam,"প্রিয় গ্রাহক, ব্র্যাক ব্যাংক ATM থেকে ডেবিট কার্ড দিয়ে সহজেই ফান্ড ট্র্যান্সফার করুন অন্যান্য ব্যাংকে I বিস্তারিতঃ tinyurl.com/FTATM1",0,1,1,1,1,0,0,0,0,0,0,0,6.28,0,116
spam,DARAZ বার্থ-ডে কোড HBDBRP7zmqre ব্যবহার করে ব্র্যাক ব্যাংক ক্রেডিট কার্ডে পাবেন ২০০০ টাকা ছাড়। tinyurl.com/DBVPJ22,0,1,1,1,1,1,0,0,1,0,0,1,6.47,0,101
spam,"[BRAC Bank] টাকা পাঠান কম খরচে! বিকাশ থেকে ব্র্যাক ব্যাংক একাউন্টে টাকা পাঠান, হাজারে মাত্র ১০ টাকা খরচে। বিস্তারিত:tinyurl.com/Bblbks2 ",0,1,1,1,1,1,0,0,1,1,0,0,5.74,0,118
spam,চার্জ ফ্রি বিদ্যুৎ ও পানির বিল দিন এখন ব্র্যাক ব্যাংক আস্থা অ্যাপ দিয়ে tinyurl.com/asthadnld,0,1,0,1,1,0,0,0,0,0,0,0,5.5,0,79
spam,শুক্র-শনিসহ সপ্তাহে ৭ দিন ব্যাংকিং এখন আস্থা অ্যাপে tinyurl.com/BBLAWB,0,1,1,1,1,0,0,0,0,0,0,0,6.56,0,62
spam,"চার্জ-ফ্রি ইন্টারনেটে হবে চার্জ-ফ্রি ব্যাংকিং। এখন Zero MB-তে ব্র্যাক ব্যাংক আস্থা অ্যাপ ব্যবহার করুন গ্রামীণফোন, রবি ও এয়ারটেল নেটওয়ার্কে tinyurl.com/BBLRFI",0,1,1,1,1,0,0,0,0,1,0,0,6.55,0,138
spam,আস্থা অ্যাপে দিনে সর্বোচ্চ ৫০ হাজার টাকা পাঠান বিকাশ ওয়ালেটে,0,0,0,0,0,1,0,0,0,0,0,0,5.1,0,51
spam,বিকাশে টাকা পাঠান ব্র্যাক ব্যাংক আস্থা অ্যাপ থেকে tinyurl.com/BRC207,0,1,1,1,1,1,0,0,0,0,0,0,6.44,0,60
spam,Six Seasons-এ ব্র্যাক ব্যাংক ক্রেডিট কার্ডে B1G3 লাঞ্চ/ডিনার। https://tinyurl.com/SixseasonsBrac,0,1,0,1,1,0,0,0,0,0,1,0,8.89,0,88
spam,"Your debit card reward points earned before 7 Jun 2020 will expire on 30 June 2021. Please, redeem your reward points by calling 16221. Details: bit.ly/3yHGSfZ",1,1,0,1,0,0,0,0,1,1,0,1,4.92,1,134
spam,NOVOAIR-এ ব্র্যাক ব্যাংক কার্ডে ১০% ছাড়। tinyurl.com/BRC159,0,1,1,1,1,0,0,0,0,0,0,0,6.86,0,53
spam,ইন্টারন্যাশনাল পেমেন্ট ও দেশের বাইরে ATM থেকে ক্যাশ তোলার সুযোগ পাবেন ব্র্যাক ব্যাংক মাল্টি-কারেন্সি ডেবিট কার্ডে। কার্ডটি ‘একদম ফ্রি’ পেতে ফোন করুন 16221 নম্বরে - ৩০ জুন’২২ এর মধ্যে। tinyurl.com/BRC209,1,1,1,1,1,0,0,0,1,0,0,1,5.66,1,173
spam,NOVOAIR-এ ব্র্যাক ব্যাংক কার্ডে ১০% ছাড়! tinyurl.com/BRC159,0,1,1,1,1,0,0,0,0,0,0,0,6.86,0,53
spam,"প্রিয় গ্রাহক, সেবার মানোন্নয়নের জন্য ২০ মে রাত ১২টা (শুক্রবার) থেকে বিকেল ৩টা পর্যন্ত ব্র্যাক ব্যাংক কার্ডের অধিকাংশ সেবা বন্ধ থাকবে। সাময়িক অসুবিধার জন্য আমরা দুঃখিত। বিস্তারিত: tinyurl.com/BBLDNTM",0,1,1,1,1,0,0,0,1,1,0,0,5.82,0,171
spam,"ব্র্যাক ব্যাংক ক্রেডিট কার্ডের মাধ্যমে ১,০০০ টাকার কেনাকাটায় ১,০০০ বোনাস রিওয়ার্ড পয়েন্ট। বিস্তারিত: tinyurl.com/BBLCM1K",0,1,1,1,1,1,0,0,1,1,0,0,7.21,0,107
spam,ফ্রিতে টাকা পাঠান আস্থা অ্যাপ থেকে যেকোন ব্যাংকে tinyurl.com/BRC202,0,1,1,1,1,1,0,0,0,0,0,0,6.33,0,59
spam,আস্থায় দিনে সর্বোচ্চ ৫০ হাজার টাকা পাঠান বিকাশ ওয়ালেটে একদম চার্জ-ফ্রি,0,1,0,0,0,1,0,0,0,0,0,0,5.36,0,60
spam,দিনে সর্বোচ্চ ৫০ হাজার টাকা পাঠান আস্থা থেকে বিকাশ ওয়ালেটে,0,0,0,0,0,1,0,0,0,0,0,0,4.9,0,49
spam,ব্র্যাক ব্যাংক ক্রেডিট কার্ড দিয়ে gozayaan.com এ হোটেল বুকিং এবং এয়ার টিকেটে অতিরিক্ত ৫০০ টাকা ছাড়! বিস্তারিত: tinyurl.com/BBLgozayaan,0,1,0,1,1,1,0,0,1,0,0,0,6.22,0,117
spam,যেকোনো রবি ও এয়ারটেল নম্বরে ইনস্ট্যান্ট রিচার্জ করুন ব্র্যাক ব্যাংক আস্থা অ্যাপ দিয়ে। বিস্তারিতঃ tinyurl.com/asthadnld,0,1,0,1,1,0,0,0,0,0,0,0,6.73,0,104
spam,প্রযুক্তি ও উদ্ভাবনেই হোক জেন্ডার বৈষম্য নিরসন। নারী দিবসের শুভেচ্ছা।,0,0,0,0,0,0,0,0,0,0,0,0,5.8,0,60
spam,নারী দিবসে TARA ডেবিট কার্ডে কেনাকাটায় ৮ গুণ  রিওয়ার্ড পয়েন্টস। T&amp;C applied. Details: tinyurl.com/bbltwd23,0,1,1,1,1,0,0,0,0,0,0,0,6.36,0,97
spam,৮ জিবি ফ্রি! আস্থায় ফিরে এসে ট্রানজ্যাকশন করলেই tinyurl.com/bblawnb,0,1,0,1,1,0,0,0,0,0,0,0,6.22,0,59
spam,প্রিয় তারা: নারী দিবসে (৮ই মার্চ) TARA কার্ড দিয়ে সব কেনাকাটায় পাচ্ছেন 8x রিওয়ার্ড পয়েন্টস। tinyurl.com/BBLWD22,0,1,1,1,1,0,0,0,0,0,0,0,5.62,0,96
spam,টাকা পাঠান কম খরচে। এখন বিকাশ থেকে ব্র্যাক ব্যাংক অ্যাকাউন্টে খরচ হাজারে মাত্র ১০ টাকা। বিস্তারিতঃ tinyurl.com/BRC204,0,1,1,1,1,1,0,0,1,1,0,0,5.71,0,101
spam,৭-৯ মার্চ ব্র্যাক ব্যাংক TARA কার্ডে উপভোগ করুন ৩ দিনের ফ্রি Chorki সাবস্ক্রিপশন। https://www.chorki.com/redeem Code CKTA-ECBKI04,0,1,1,1,1,0,0,0,1,0,1,0,6.56,0,114
spam,"৬-৮ মার্চ পর্যন্ত আড়ং, স্বপ্ন, শেফস্‌ টেবিলে TARA ডেবিট কার্ডে ৮% ক্যাশব্যাক। T&amp;C applied. Details: tinyurl.com/bbltwd23",0,1,1,1,1,0,0,0,1,0,0,0,6.06,0,109
spam,বিকাশে টাকা পাঠাতে চান? ব্র্যাক ব্যাংক আস্থা অ্যাপ ব্যবহার করুন। বিস্তারিতঃ tinyurl.com/asthadnld,0,1,0,1,1,1,0,0,0,0,0,0,6.83,0,86
spam,একমাত্র ব্র্যাক ব্যাংক ডেবিট কার্ডে কেনাকাটায় পাবেন রিওয়ার্ড পয়েন্টস! 16221-এ ফোন করে পয়েন্টস দিয়ে কার্ডের ট্রানজ্যাকশন রিডিম করুন। https://tinyurl.com/BBLDCRP01,1,1,1,1,1,0,0,0,0,0,1,1,7.21,1,145
spam,"হোটেল আগ্রাবাদ (01755513841), র‍্যাডিসন ব্লু চট্টগ্রাম (01777701164) ও পেনিনসুলা চিটাগাং (01755554551) এ B1G1 ব্যুফে ইফতার BBL কার্ডে!",1,1,1,0,1,0,1,0,0,0,0,0,6.41,0,118
spam,রোজার মাসে ভ্রমণে ২০০০ পয়েন্টস BBL ক্রেডিট কার্ডে! tinyurl.com/BBLHRO,0,1,1,1,1,0,0,0,0,0,0,1,6.44,0,61
spam,নারীদের জন্য ‘TARA’ ক্রেডিট কার্ডে অ্যানুয়াল ইন্টারেস্ট এখন মাত্র ১৬%। আবেদন করতে কল করুন ১৬২২১ এ।,1,1,1,0,1,0,0,0,0,0,0,1,4.88,1,83
spam,১০ টাকায় বিকাশ থেকে ব্র্যাক ব্যাংকে হাজার টাকা পাঠান tinyurl.com/BRC204,0,1,1,1,1,1,0,0,1,0,0,0,6.0,0,62
spam,অনলাইন ঈদ শপিংয়ে ৭০% পর্যন্ত ছাড় BBL কার্ডে! tinyurl.com/BBLONL,0,1,1,1,1,0,0,0,0,0,0,0,5.67,0,55
spam,চার্জ ফ্রি মোবাইল রিচার্জ বিবিএল আস্থা অ্যাপে tinyurl.com/asthadnld,0,1,0,1,1,0,0,0,0,0,0,0,7.25,0,60
spam,"ঈদে ভ্রমণ হোক আনন্দময়, ৭০% পর্যন্ত ছাড় BBL কার্ডে! tinyurl.com/BBLRST",0,1,1,1,1,1,0,0,0,0,0,0,5.5,0,60
spam,১০০+ ডাইন-ইন আউটলেটে BBL কার্ডে ৩৫% পর্যন্ত ছাড়! tinyurl.com/BBLDNG,0,1,1,1,1,0,0,0,0,0,0,0,5.89,0,59
spam,Secret Recipe থেকে ইফতার কিনুন ২০% ছাড়ে BBL কার্ডে! tinyurl.com/BBLSRO,0,1,1,1,1,0,0,0,0,0,0,0,5.7,0,61
spam,শুক্র-শনিসহ সপ্তাহে ৭ দিন ব্যাংকিং এখন আস্থা অ্যাপে tinyurl.com/BRC190,0,1,1,1,1,0,0,0,0,0,0,0,6.56,0,62
spam,ঈদ শপিংয়ে ২০০০ রিওয়ার্ড পয়েন্টস BBL ক্রেডিট কার্ডে! tinyurl.com/BBLSMC,0,1,1,1,1,0,0,0,0,0,0,1,6.56,0,62
spam,BBL কার্ডে B1G1 অফারে রমজান জুড়ে হোক ইফতার ও ডিনার! tinyurl.com/BBLBGI,0,1,1,1,1,0,0,0,0,0,0,0,5.18,0,60
spam,অনলাইন ঈদ শপিংয়ে ১৫% ক্যাশব্যাক BBL ক্রেডিট কার্ডে! tinyurl.com/BBLCHB,0,1,1,1,1,0,0,0,0,0,0,0,6.44,0,62
spam,ব্র্যাক ব্যাংক TARA কার্ডে Ujjwala-র স্কিল ডেভেলপমেন্ট কোর্সে পাচ্ছেন ২০% পর্যন্ত ছাড়। Query: 01953300456 http://ujjwala.co,1,1,1,1,1,0,1,0,0,0,1,0,6.73,0,109
spam,১০টাকায় বিকাশ থেকে ব্র্যাক ব্যাংকে হাজার টাকা পাঠান tinyurl.com/BRC204,0,1,1,1,1,1,0,0,1,0,0,0,6.67,0,62
spam,ব্র্যাক ব্যাংক TARA কার্ডে The Mall ওয়েবসাইটে ১০% ছাড়। প্রোমো কোড: #themallbrac www.themallbd.com,0,1,1,1,1,0,0,0,0,0,0,0,6.08,0,85
spam,বিকাশে টাকা পাঠান ব্র্যাক ব্যাংক আস্থা অ্যাপ থেকে tinyurl.com/BRC207,0,1,1,1,1,1,0,0,0,0,0,0,6.44,0,60
spam,নারী দিবস উপলক্ষ্যে মার্চ মাসে TARA পার্সোনাল লোন পাচ্ছেন মাত্র ৮.৯৯% ইন্টারেস্টে! tinyurl.com/bbltwd23,0,1,1,1,1,0,0,0,1,0,0,0,6.62,0,91
spam,নারী দিবস উপলক্ষে পুরো মার্চ জুড়ে ব্র্যাক ব্যাংক TARA কার্ডে উপভোগ করুন ৫৫% পর্যন্ত ডিসকাউন্ট ১২৭টি আউটলেটে। tinyurl.com/BBLWD22,0,1,1,1,1,0,0,0,0,0,0,0,5.94,0,111
spam,"ব্র্যাক ব্যাংকের &apos;মাল্টি-কারেন্সি&apos; ডেবিট কার্ডে আছে ইন্টারন্যাশনাল পেমেন্ট, বিদেশে ATM থেকে ক্যাশ তোলার সুযোগ! ফ্রি মাল্টি-কারেন্সি ডেবিট কার্ড পেতে ফোন করুন ১৬২২১ নম্বরে। tinyurl.com/BRC209",1,1,1,1,1,0,0,0,0,1,0,1,6.92,1,177
spam,ব্র্যাক ব্যাংকের মোবাইল অ্যাপ &quot;আস্থা&quot; ব্যবহার করে ব্যাংকিং সুবিধা নিন শুক্র-শনিবার সহ সপ্তাহের সকল দিন। বিস্তারিতঃ tinyurl.com/BRC190,0,1,1,1,1,0,0,0,0,0,0,0,7.0,0,127
